{
  "v": "ACDCCAACAAJSONAAew.",
  "t": "acm",
  "d": "EIvXCi7R5yUQryGnUAL1O60q5N_s-Cbi_hf7dTIQThIv",
  "u": "0ADUwiKlTCMXb-ppR5bvLJQF",
  "i": "EASQ29X2bmJ72RpqJaoAj1q14TPlUtp1XFeCSSMnAAr1",
  "rd": "EAOctA0jYqNRqic7jNqqlSOVyaiVSevDocIdsDRtZpsO",
  "s": "EF5YZr7JLPNXKbq1PEnpTf1IsrgxLFZyVqfoR_vniUgY",
  "a": {
    "d": "EMG1cawa1ZYj3e2tx95vQjUeE9TvJ2fZrifT8pZm1hhM",
    "dt": "2026-08-28T12:00:00+00:00",
    "format": "dc+sd-jwt",
    "credentialType": "urn:eudi:pid:1",
    "issuerChain": [
      {
        "subject": "C=UT,O=EUDI Wallet Reference Implementation,2.5.4.97=LEIEU-123456789,CN=PID DS - 002",
        "sha256": "e62c5d3cc29089acbb934e9811d441cc10e0b6dde8a292c5e4239e632e645419"
      }
    ],
    "trustAnchor": {
      "subject": "C=UT,O=EUDI Wallet Reference Implementation,CN=PID Issuer CA - UT 02",
      "sha256": "f5d8b03daf986de86202f886b98dc42a05bab4486ba3e262e9c5760bdf5c4500"
    },
    "checks": [
      "size-bound",
      "framing",
      "typ",
      "chain",
      "certificate-revocation",
      "signature",
      "time-window",
      "disclosure-digests"
    ],
    "caveats": [
      "w.proof.identity.unbindable.f",
      "w.proof.binding.absent.f",
      "w.proof.revocation.unchecked.f"
    ],
    "verifiedAt": "2026-08-28T12:00:00+00:00",
    "foreignIssuer": "https://backend.issuer.eudiw.dev",
    "u": "0ACcGnOKdLdYbGuFjgopCM8r",
    "i": "EDILsuevQgE7T5nwcurEetTonIDfwfms0Ulwc4OSMiyk"
  },
  "r": {
    "d": "ELGhB_hackGxbEGXJFS5joB4w1FsBHCxvYsF14cOltoL",
    "evidenceNotEndorsement": "The issuer records which checks it ran on a foreign credential and what they found at verifiedAt. It does not endorse the foreign issuer's claims, and a verifier MUST NOT read this credential as asserting any of them.",
    "checksAsOfVerifiedAt": "Every check describes the foreign credential as it stood at verifiedAt. A later revocation of the foreign credential or its certificates is not reflected here, and a verifier relying on current standing MUST check the foreign credential itself.",
    "noClaimValues": "This credential carries no claim value from the foreign credential. The issuer MUST NOT add personal data from it, and a holder presenting this credential discloses only that the listed checks ran."
  }
}
